{
  "$schema": "https://json-schema.org/draft/2020-12/schema",
  "$id": "https://unpkg.com/specpulse/schema/config.schema.json",
  "title": "specpulse config",
  "description": "specpulse.config.json (or .specpulse.json) in the project root. Every field is optional.",
  "type": "object",
  "additionalProperties": false,
  "properties": {
    "$schema": {
      "type": "string"
    },
    "$comment": {
      "type": "string"
    },
    "title": {
      "type": "string",
      "minLength": 1,
      "description": "Dashboard title. Default: package.json name, else the folder name."
    },
    "locale": {
      "enum": ["en", "pt-BR", "es"],
      "default": "en",
      "description": "Dashboard language."
    },
    "outDir": {
      "type": "string",
      "minLength": 1,
      "default": ".cache/specpulse",
      "description": "Output folder (index.html, img/, history/). Add it to .gitignore."
    },
    "dataFile": {
      "type": "string",
      "minLength": 1,
      "default": "docs/progress.json",
      "description": "Data file with manual milestone status, milestone → specs and image approval."
    },
    "roadmap": {
      "type": "string",
      "minLength": 1,
      "default": "docs/roadmap.md",
      "description": "Markdown with the phase table: rows starting with | [N](link) | Name | How to test | Focus |."
    },
    "phaseFile": {
      "type": "string",
      "minLength": 1,
      "default": "docs/phase-{n}/README.md",
      "description": "Per-phase markdown with milestone rows | **N.M Name** | Delivery |. {n} = phase number."
    },
    "specs": {
      "type": "object",
      "additionalProperties": false,
      "properties": {
        "dir": {
          "type": "string",
          "minLength": 1,
          "default": "docs/specs"
        },
        "idPattern": {
          "type": "string",
          "minLength": 1,
          "default": "[A-Z]+-\\d{3,}",
          "description": "Regex for spec IDs: file names start with it, headings are '# <ID> · Title', commits cite it."
        },
        "format": {
          "enum": ["markdown", "frontmatter", "auto"],
          "default": "markdown",
          "description": "markdown: \"# <ID> · Title\" + checkboxes, file name starts with the ID. frontmatter: YAML block with id/title/status/milestone. auto: per file, frontmatter when the file starts with a closed --- block, otherwise markdown."
        },
        "acceptanceHeading": {
          "type": "string",
          "minLength": 1,
          "description": "Only checkboxes under this heading and its subsections count (case-insensitive, trailing colon ignored). A spec without the heading counts no criteria."
        },
        "idFrom": {
          "enum": ["heading", "filename", "frontmatter"],
          "description": "Where the spec ID comes from. When set, only this source is used; with filename the file name must start with the ID. Default: heading for markdown; id, then heading, then file name for frontmatter."
        }
      }
    },
    "gallery": {
      "type": "object",
      "additionalProperties": false,
      "required": ["dir"],
      "description": "Enables the Gallery and Timeline sections.",
      "properties": {
        "dir": {
          "type": "string",
          "minLength": 1,
          "description": "Folder with the reference images."
        },
        "referenceExt": {
          "type": "string",
          "minLength": 1,
          "default": ".png"
        },
        "sceneExt": {
          "type": "string",
          "minLength": 1,
          "description": "When set, each <name><sceneExt> file is a scene; otherwise each reference image is one."
        },
        "render": {
          "type": "string",
          "minLength": 1,
          "description": "Shell command rendering one scene to PNG. Placeholders: {scene}, {out}, {name}."
        }
      }
    },
    "timelineLimit": {
      "type": "integer",
      "minimum": 1,
      "default": 30
    },
    "live": {
      "type": "object",
      "additionalProperties": false,
      "description": "Live view options (only used with --serve).",
      "properties": {
        "check": {
          "type": "string",
          "minLength": 1,
          "description": "Shell command for \"run check\", e.g. \"pnpm -s check\"."
        },
        "checkOnChange": {
          "type": "boolean",
          "default": false,
          "description": "Also run check after file changes (long debounce, never in parallel)."
        },
        "claudeSessions": {
          "type": "boolean",
          "default": false,
          "description": "Opt-in: show metadata (tool, file, time) of local Claude Code sessions of this project. Never prompt text."
        },
        "commits": {
          "type": "integer",
          "minimum": 1,
          "default": 30,
          "description": "Commits shown in the Live feed."
        }
      }
    }
  }
}
